{
	"schemaVersion": "equipment-rank-first-assignment-v3",
	"assignmentId": "assignment-material-equipment-v3-iron-heavy-armor-head-v3",
	"targetId": "material-equipment-v3-iron-heavy-armor-head-v3",
	"immutable": true,
	"classDirection": {
		"path": "assets/equipment/experiments/rank-first-calibration-2026-09-02/heavy-armor-metal-ranks-v1.png",
		"sha256": "e43eebe931c75330abe54d39b35a97b69bc1e18c2e349c31eff1bb0b096683da",
		"purpose": "Rank escalation, silhouette, and finish only; production must remove mannequin/body impression."
	},
	"materialBrief": {
		"path": "assets/equipment/experiments/material-equipment-v3/direction/material-briefs/e-iron.json",
		"canonicalSha256": "9a934caaf3d627c5abc6d7bab10dc65386ed6fa01ea0c945937f4276632528a3"
	},
	"finishReference": {
		"path": "assets/equipment/experiments/material-vs-class-calibration-2026-09-02/approach-a-steel-material-cohort-v1.png",
		"sha256": "6749ad1a65b995f48b89b0c1c8c8ee051da145315f5fd60775803f691ad7b887",
		"purpose": "Accepted painterly finish and cross-class material-coherence reference; do not copy geometry."
	},
	"consistencySource": {
		"path": "assets/equipment/experiments/material-equipment-v3/candidates/e/iron/heavy-armor-full-set-v3.png",
		"sha256": "55aedcb94ce7b5b7ba695c669c5198f752d4da3922406d61d8d52d2298f93992",
		"purpose": "Owner-accepted full Armor set; authoritative source for piece reconstruction."
	},
	"prompt": "Render only the head item from the accepted full set. Preserve its exact material, palette, silhouette language, trim, fastenings, wear, ornament, and slot boundary. Do not redesign it.\n\nCLASS DIRECTION: Broad articulated metal protection comprising exactly Head, Torso, Legs, and Boots. Empty self-supporting full set in a consistent mild three-quarter front view; no mannequin or wearer. Use the accepted progression reference as the authoritative design for the E column while reconstructing it as a dedicated render. Preserve rank silhouette and distinctive structural cues; do not crop.\n\nMATERIAL BRIEF — Iron:\nPalette: Cool charcoal-gray metal with pale gray edges and near-black recesses.\nValue: Dark middle values with stronger edge highlights than Bronze.\nSurface/wear: Forged texture, hammer marks, fine scratches, and sparse red-brown oxidation at joints.\nConstruction: Straightforward forged profiles, visible peening, reinforced rims, straps, and practical rivets.\nSupernatural behavior: None.\nNeutral secondary materials: Dark wood, brown leather, charcoal cloth, and tiny bronze fasteners.\nNeighbor distinction: Cooler, harder-edged, and more deliberately forged than Bronze; less refined than Steel.\n\nOne isolated head only; no other set pieces, body part, wearer, mannequin, or display stand.\n\nSTYLE/OUTPUT: premium realistic-painterly dark fantasy equipment inventory art; grounded construction; honest material response; cold key light, restrained warm rim, midnight-charcoal studio ground with restrained floor plane. One fully visible object centered on a 1024×1024 portrait-or-square canvas, about 8% margin and never below 5%; readable at 128px. No text, labels, UI, border, watermark, signature, scenery, extra objects, hands, wielder, detached particles, uncontrolled glow, or recognizable reference copying.\n\nThe accepted full-set source is the first and authoritative visual reference. Match it exactly.",
	"promptSha256": "aed20ba02860d5cb524635da7ad44a877206d1004702bd24203cb56c52bc5221",
	"permittedOutputs": {
		"candidatePath": "assets/equipment/experiments/material-equipment-v3/candidates/e/iron/heavy-armor-head-v3.png",
		"resultPath": "assets/equipment/experiments/material-equipment-v3/results/e/iron/heavy-armor-head-v3.json"
	},
	"forbiddenActions": [
		"crop-progression-sheet",
		"overwrite-existing-output",
		"write-outside-permitted-outputs",
		"self-promote-to-approved",
		"write-runtime-catalog",
		"modify-v1-or-v2"
	]
}
