{
	"schemaVersion": "equipment-rank-first-assignment-v3",
	"assignmentId": "assignment-material-equipment-v3-coarse-hide-light-armor-boots-v3",
	"targetId": "material-equipment-v3-coarse-hide-light-armor-boots-v3",
	"immutable": true,
	"classDirection": {
		"path": "assets/equipment/experiments/material-equipment-v3/direction/class-progressions/light-armor-hide-scale-ranks-v3.png",
		"sha256": "4aeead1698bd2e6ba26e8c007c92248288c452b0254c4bb16fc09f4ca5e7a4a9",
		"purpose": "Requires owner checkpoint 1 acceptance for rank escalation, silhouettes, finish, camera, and empty-set treatment."
	},
	"materialBrief": {
		"path": "assets/equipment/experiments/material-equipment-v3/direction/material-briefs/f-coarse-hide.json",
		"canonicalSha256": "3386393eb8522477cd77a57afefaea09f17006fb348cd9f58bc62d3e84567c74"
	},
	"finishReference": {
		"path": "assets/equipment/experiments/material-vs-class-calibration-2026-09-02/approach-a-steel-material-cohort-v1.png",
		"sha256": "6749ad1a65b995f48b89b0c1c8c8ee051da145315f5fd60775803f691ad7b887",
		"purpose": "Accepted painterly finish and cross-class material-coherence reference; do not copy geometry."
	},
	"consistencySource": {
		"path": "assets/equipment/experiments/material-equipment-v3/candidates/f/coarse-hide/light-armor-full-set-v3.png",
		"sha256": "b51335521e27af145621d249e597ea4e63842637b4d4469fe8eb201612f0a532",
		"purpose": "Owner-accepted full Armor set; authoritative source for piece reconstruction."
	},
	"prompt": "Render only the boots item from the accepted full set. Preserve its exact material, palette, silhouette language, trim, fastenings, wear, ornament, and slot boundary. Do not redesign it.\n\nCLASS DIRECTION: Mobile hide- or scale-led protection comprising exactly Head, Torso, Legs, and Boots. Empty self-supporting full set in a consistent mild three-quarter front view; no mannequin or wearer. Use the accepted progression reference as the authoritative design for the F column while reconstructing it as a dedicated render. Preserve rank silhouette and distinctive structural cues; do not crop.\n\nMATERIAL BRIEF — Coarse Hide:\nPalette: Earth brown, dusty tan, and soot-dark seams.\nValue: Middle-dark with broad matte shapes.\nSurface/wear: Uneven thickness, visible pores, raw edges, creases, scuffs, and patched abrasions.\nConstruction: Large overlapping hide panels, simple ties, crude stitching, and few hard fittings.\nSupernatural behavior: None.\nNeutral secondary materials: Hemp thread, plain wood toggles, dull bronze, and undyed lining.\nNeighbor distinction: Softer, rougher, and less formed than Hard Leather; no polished rigid cuirass shapes.\n\nOne isolated boots only; no other set pieces, body part, wearer, mannequin, or display stand.\n\nSTYLE/OUTPUT: premium realistic-painterly dark fantasy equipment inventory art; grounded construction; honest material response; cold key light, restrained warm rim, midnight-charcoal studio ground with restrained floor plane. One fully visible object centered on a 1024×1024 portrait-or-square canvas, about 8% margin and never below 5%; readable at 128px. No text, labels, UI, border, watermark, signature, scenery, extra objects, hands, wielder, detached particles, uncontrolled glow, or recognizable reference copying.\n\nThe accepted full-set source is the first and authoritative visual reference. Match it exactly.",
	"promptSha256": "845cfba40be55682ee4cd4542c5a37cd97a91d029dc3fdeaad686be0399c2347",
	"permittedOutputs": {
		"candidatePath": "assets/equipment/experiments/material-equipment-v3/candidates/f/coarse-hide/light-armor-boots-v3.png",
		"resultPath": "assets/equipment/experiments/material-equipment-v3/results/f/coarse-hide/light-armor-boots-v3.json"
	},
	"forbiddenActions": [
		"crop-progression-sheet",
		"overwrite-existing-output",
		"write-outside-permitted-outputs",
		"self-promote-to-approved",
		"write-runtime-catalog",
		"modify-v1-or-v2"
	]
}
